{
  "profileVersion": "thought-khoral.agent-conversation.v1",
  "taskId": "00000006-1111-4111-8111-000000000006",
  "conversationId": "00000005-1111-4111-8111-000000000005",
  "generation": 1,
  "replyEventId": "00000016-1111-4111-8111-000000000016",
  "replySequence": 6,
  "textDigest": "6c4bb74b93a3752517f2550374f8942da8cb0b4dda42338445cc7ca8976d1759",
  "consumedRevision": 5,
  "contextDigest": "d72f81e3da10a0b3f0c9f1bafc32bc1f6afea94875ab0e7ee2b0d6f31c157e62"
}
